{
  "baseRevision": "6dc8ed1bceaa563c4e2cddb505b5891741bbce5a",
  "evidence": [
    {
      "blobOid": "7d56eb747573d8ae30862afd7265f746462a4fb3",
      "id": "evidence:sha256:c24e79aa636b293b2c951a110fddaca1c44a59b9ceee459b4ec3be61ff6d7795",
      "path": "docs/specs/corvint-tasks-agent-leases-v0.md",
      "span": {
        "end": 30381,
        "start": 29996
      },
      "spanSha256": "ddf2028d5d2d85e4ad69a8a8185ed6212bcdcd1b90699b3b6c95b385283c73b1"
    },
    {
      "blobOid": "cf25bd04f315702a1c5257b32830d8f8efe3eb64",
      "id": "evidence:sha256:f95057728394ba2dcb51412c100e4b6b55f97901575e4cd2f8a70f6d4aeea160",
      "path": "Makefile",
      "span": {
        "end": 9752,
        "start": 9193
      },
      "spanSha256": "6f066409c053fdb23403b2603d17254058824721f5cbeaaf0543fcf429cdceb4"
    },
    {
      "blobOid": "7d56eb747573d8ae30862afd7265f746462a4fb3",
      "id": "evidence:sha256:d01de0399bcd09f281b7752375d59a24708d16d0d05761856275e71c994529c8",
      "path": "docs/specs/corvint-tasks-agent-leases-v0.md",
      "span": {
        "end": 30679,
        "start": 30381
      },
      "spanSha256": "4015f9e16ee8977f6cd853d09c5cf117628ee84aee756ffc6f8d67de461f05ee"
    },
    {
      "blobOid": "ca07cfe1f96d2e76bae7fb732f7954a23d2224b8",
      "id": "evidence:sha256:7a793e202a9fadad9fecb2915b925448768576e4634f89abbd231eedef6996a3",
      "path": "internal/contextindex/eval_query.go",
      "span": {
        "end": 8380,
        "start": 7979
      },
      "spanSha256": "bd89f09f6d06dbb1bdf58ce1f6ac24fa9c18410e7f62c6e2e63ab2d63664155c"
    },
    {
      "blobOid": "f1bfba0ecbdc22928d680fe7190103aaccd117ce",
      "id": "evidence:sha256:6eedb995a73541f2bf46f31938092104012c16d7b12e1fe063d1f0d2553920c4",
      "path": "internal/tasks/store/workflow.go",
      "span": {
        "end": 3259,
        "start": 2945
      },
      "spanSha256": "a75168068bb764f23c6c93d95b1389d4ac2f897a655899bf89476df6dd0cf5be"
    }
  ],
  "excludedPath": ".corvint/change.cem.json",
  "hunks": [
    {
      "basis": [
        {
          "evidenceId": "evidence:sha256:c24e79aa636b293b2c951a110fddaca1c44a59b9ceee459b4ec3be61ff6d7795",
          "relation": "specification"
        }
      ],
      "disposition": "supported",
      "id": "hunk:sha256:1efb5b70226a96ae289b7cda5d6d33461692d641c992e952b8dc0607e5a10fd2",
      "newRange": {
        "count": 34,
        "start": 1
      },
      "oldRange": {
        "count": 0,
        "start": 0
      },
      "path": "docs/build-log/2026-09-29-tasks-context-identity.md",
      "reason": "evidence-backed"
    },
    {
      "basis": [
        {
          "evidenceId": "evidence:sha256:f95057728394ba2dcb51412c100e4b6b55f97901575e4cd2f8a70f6d4aeea160",
          "relation": "implementation"
        }
      ],
      "disposition": "supported",
      "id": "hunk:sha256:9d21f236466bdfbfa6c1044dea94490d74eb585388db7ffda76fe815196556a6",
      "newRange": {
        "count": 11,
        "start": 286
      },
      "oldRange": {
        "count": 11,
        "start": 286
      },
      "path": "docs/specs/REQUIREMENTS.tsv",
      "reason": "evidence-backed"
    },
    {
      "basis": [
        {
          "evidenceId": "evidence:sha256:d01de0399bcd09f281b7752375d59a24708d16d0d05761856275e71c994529c8",
          "relation": "specification"
        }
      ],
      "disposition": "supported",
      "id": "hunk:sha256:0bc0eda1ba88c2e6f85329312979373b8c99b7a035532e690fc72f7966bd4b08",
      "newRange": {
        "count": 10,
        "start": 377
      },
      "oldRange": {
        "count": 7,
        "start": 377
      },
      "path": "docs/specs/corvint-tasks-agent-leases-v0.md",
      "reason": "evidence-backed"
    },
    {
      "basis": [
        {
          "evidenceId": "evidence:sha256:7a793e202a9fadad9fecb2915b925448768576e4634f89abbd231eedef6996a3",
          "relation": "implementation"
        }
      ],
      "disposition": "supported",
      "id": "hunk:sha256:34c6e0938c26c9e00e0f2e8c8808b0aba2a23775de22b08bc2ec96540139bf47",
      "newRange": {
        "count": 7,
        "start": 21
      },
      "oldRange": {
        "count": 6,
        "start": 21
      },
      "path": "internal/tasks/store/workflow.go",
      "reason": "evidence-backed"
    },
    {
      "basis": [
        {
          "evidenceId": "evidence:sha256:6eedb995a73541f2bf46f31938092104012c16d7b12e1fe063d1f0d2553920c4",
          "relation": "implementation"
        },
        {
          "evidenceId": "evidence:sha256:7a793e202a9fadad9fecb2915b925448768576e4634f89abbd231eedef6996a3",
          "relation": "implementation"
        }
      ],
      "disposition": "supported",
      "id": "hunk:sha256:af0b76b339cdefc3e9c0f38371a23ea277f79f5f9ccd3378855f63f80da754a5",
      "newRange": {
        "count": 14,
        "start": 110
      },
      "oldRange": {
        "count": 9,
        "start": 109
      },
      "path": "internal/tasks/store/workflow.go",
      "reason": "evidence-backed"
    },
    {
      "basis": [
        {
          "evidenceId": "evidence:sha256:6eedb995a73541f2bf46f31938092104012c16d7b12e1fe063d1f0d2553920c4",
          "relation": "implementation"
        },
        {
          "evidenceId": "evidence:sha256:c24e79aa636b293b2c951a110fddaca1c44a59b9ceee459b4ec3be61ff6d7795",
          "relation": "specification"
        }
      ],
      "disposition": "supported",
      "id": "hunk:sha256:42b8af8218d89b7233858b9ccdb633747426eea83e9093b6f41fd7f64af9884b",
      "newRange": {
        "count": 223,
        "start": 1
      },
      "oldRange": {
        "count": 0,
        "start": 0
      },
      "path": "internal/tasks/store/workflow_context_test.go",
      "reason": "evidence-backed"
    }
  ],
  "patchSha256": "c30e6cad4ddecfbf2d7498b46ede3f0ecd2106e1b7509b6da75e01e436faae96",
  "spec": "cem/0.2"
}
